{
  "schemaVersion": 1,
  "channel": "stable",
  "sequence": 3,
  "issuedAt": "2026-09-15T21:24:32Z",
  "releaseId": "2026.09.2",
  "compatibility": {
    "minAndroidApiLevel": 28,
    "minAppVersionCode": 10,
    "catalogsSchemaVersion": 1,
    "supportedRuntimeFamilies": [
      "sherpa-onnx",
      "gguf",
      "pyannote"
    ],
    "supportedConfigFamilies": [
      "speech-model-catalog",
      "cleanup-model-catalog",
      "speaker-diarization-manifest"
    ]
  },
  "catalogs": {
    "speech": {
      "filename": "model_catalog.json",
      "path": "../releases/2026.09.2/model_catalog.json",
      "sha256": "1a836c51899220faf14c0f459f9aa08b0731791d4f136a387d518ae699a878e9",
      "sizeBytes": 35647
    },
    "diarization": {
      "filename": "speaker_diarization_manifest.json",
      "path": "../releases/2026.09.2/speaker_diarization_manifest.json",
      "sha256": "7f6d32bb6a20b9ad26a03130645b7dbfaecc97d785dca6538a92f05b5f8cde45",
      "sizeBytes": 1521
    },
    "cleanup": {
      "filename": "cleanup_model_catalog.json",
      "path": "../releases/2026.09.2/cleanup_model_catalog.json",
      "sha256": "50649bf2a0a2d38172448dcc74b840ff5ba301d6c1ea90be3a2aef681658a697",
      "sizeBytes": 1182
    }
  },
  "notes": "Promote verified model selection guidance release after QA publication",
  "gitCommit": "80b0945235903a955a49b04604b9b59f2cf625d1"
}
